review_2500243336,Joanne,"Aug 23, 2018","Brilliant, it’s been awhile since I gave a 5⭐️ Rating but this book is deservingly so. Fabulous, had me hook from start to finish. I loved the approach by the author. This isn’t your typical who done it. From the start you know who and how but keep reading cause it’s just the tip,of the iceberg and all will be revealed in the most unexpected way, totally blew me away. 👏👏👏👏👏👏👍👍👍😎 btw the ending —HEARTBREAKING!",5,10 likes,1
review_2648078213,Nisa,"Jan 16, 2019","I like the storyline. The author knows how to direct the reader into a situation though the situation was overwhelmed and complicated. Initially, mysterious then complicated in the middle and solved by the end. Not only that, I appreciate each value in each situation that the author describes. Thank you! I love this",4,0 likes,1
review_1877877075,Pavel Sikora,"Jan 13, 2017","I liked the concept of us—the readers—watching both sides (the “bad guys” as well as the “good guys”), not really being able to decide who do we want to win. It didn't really matter that we knew from the start what had happened (or did we?). However, even if the book was a nice read, to say Keigo Higashino is the “Japanese Stieg Larsson” is—I think—a bit too bold.",3,1 like,1
review_4539578721,Seojung Choi,"Feb 09, 2022",this,5,0 likes,1
review_2384696108,Jiwoo Kim,"May 07, 2018","The Devotion of Suspect X is a detective fiction book by Keigo Higashino. I like this book because it is different from the other detective fiction book. The normal detective fiction books are the reader read the story about the person who follows the suspect or the suspect, but this book is the reader read the story about the person close to the suspect. The story is focused on the suspect's side. The three reasons why I can focus on the book more than the other books that I read before are the simile, mood, and foreshadowing that the author used in the book. The first thing that I like about this book is the simile. The author use simile to create mood, which the second thing that I like about in the book. In the book, “The man looked around the shop, both hands thrust into the pockets of his dark navy windbreaker, like a prospective customer trying to figure out what he should buy”. In this sentence, the author use simile to create the mood of the man. Example for the foreshadowing is this, “She had only recently learned that he taught math when she happened to notice outside his apartment door a bundle of old math textbooks, wrapped in string and awaiting disposal”. This means that Ishigami is smart enough to teach math and this will go to affect her. I recommend this book to the young adult age people and adults because this book is complicated for the young age. Or I recommend this book to the people who want to try another style of detective noble.",4,0 likes,1
review_2767025244,Budi Amir,"Dec 05, 2021",Very interesting and detailed investigation,4,0 likes,1
review_3061940532,Mimi Wolske,"Nov 25, 2019","Letting the reader learn everything about the muder -- the why, who, and how -- in the first couple of chapters isn't new. Yasuko and her daughter, Misato, killed the husband/father. Then, their neighbor, Ishigami, calls and offers to help them bury the body.
How'd he know?
Well, it's Ishigami’s brilliant cover-up that drives the story forward! OMGosh! Brilliant writing!
Anyway, Detective Kusanagi of the Edogawa police and his friend, Yukawa, a friend and a genius who sometimes helps the police, battle to find the truth surrounding Togashi’s murder.
The truth they try to prove is that Yasuko's story is a lie.
We readers see fragments of Ishigami’s plan... At first it seems simplistic; even sort of careless. However, we discover all too soon it's actually quite a deceptive plan and it's pretty complex.
Oh, yeah, Ishigami is a mathematical genius and he's a logical thinker and even tells mother and daughter that logic will get them through everything... yes, he actually applies math ideas to their problem like in that TV series ""Numb3rs"".
I totally, 110% recommend this book to those who love mysteries.",5,0 likes,1
review_2759317939,Matthew,"Mar 22, 2019",Felt like a distinctly different murder mystery/thriller. I enjoyed the interplay between the characters and really felt for the main people. However the ending hurt.,3,0 likes,1
review_4477454838,eisha sarkar,"Jan 21, 2022","These books got me through Covid 19, through sickness and fatigue, a fortnight of quarantine. So grateful to the author!",5,0 likes,1
review_2458768315,Shubhadeep Bhattacharyya,"Jul 16, 2018",One of the best detective novels out there. Outstanding storytelling.,5,0 likes,1
review_4333902254,Alice Nguyen,"Nov 12, 2021","Personally, this is the greatest book of Keigo I've ever read. Highly recommend it 🙆📘",5,0 likes,1
review_2915237158,Avishek Gupta,"Jul 28, 2019",All three books are brilliant and amazing with fantastic Plot twist. Must read for thriller lovers.,4,0 likes,1
review_3181163554,Doris,"Feb 07, 2020",Amazing book!,4,0 likes,1
review_2881197329,Hermance,"Jul 28, 2019","I highly recommend Devotion of Suspect X. This book is so good! I loved everything about it!

Keigo Higashino is a master of thriller.",5,0 likes,1
review_4488351749,Sangeet,"Jan 19, 2022",salvation of a saint was the best amongst the three. To know the murderer from the start but what is the motive???,4,0 likes,1
review_4433442001,Samiksha Shrivastav,"Jan 01, 2022",,4,0 likes,1
review_3577363198,An Nguyễn,"Oct 03, 2020",,5,0 likes,1
review_2274608491,Adarsh,"Jan 27, 2018",,4,0 likes,1
review_2679803777,Suzieana,"Jan 18, 2019",,5,0 likes,1
review_4349933414,An Nguyen,"Nov 21, 2021",,5,0 likes,1
review_2792477903,silviana siauw,"Apr 21, 2019",,5,0 likes,1
review_2292731464,David,"Feb 11, 2018",,3,0 likes,1
review_2912114782,Judy Chen,"Jul 26, 2019",,5,0 likes,1
review_2799687661,Ashesh,"Apr 26, 2019",,3,0 likes,1
review_2378489069,Glenda,"May 01, 2018",,5,0 likes,1
review_3864537455,Kamal Chopra,"Feb 28, 2021",,4,0 likes,1
review_2607283776,YuetLin,"Nov 27, 2018",,4,0 likes,1
review_4361812452,Rifqi Arya,"Nov 29, 2021",,4,0 likes,1
review_2495656085,Binhtran135,"Aug 15, 2018",,4,0 likes,1
review_2818172361,Janar,"May 12, 2019",,5,0 likes,1
review_3297391219,Jesse (JesseTheReader),"May 05, 2020","I loved this book so much! It has everything that I love in a book. The way in which it weaves the story together connecting all the characters was what completely won me over. All the characters are given such detailed backgrounds that they feel real. I didn't love the way in which some of the advice was being worded by the boys sending out the advice letters, but it was realistic to the situation at hand. I'm so thrilled that this one was a win for me!",0,532 likes,2
review_4614409420,STEPH,"Apr 22, 2022","For me; There is something special about books that could REALLY make me cry. This book hit all the right marks. It aimed, targeted and shot me through the heart. And I’m still trying to recover from it as I am writing this review.

I wonder how my life would be if I drop a letter to the Namiya General Store. Who’s going to answer my life’s quandary? Mr. Namiya or the three burglars? This novel kind of reminded me of Before The Coffee Gets Cold because of its magical connection with TIME. Completely unrelated in terms of the premise but reading Japanese books is slowly becoming the norm for me. They bring a different colour to my reading experience.

I completely and hands down reccommend this book to everyone. One little reminder, though. YOU WILL LIKELY CRY SO BRACE YOURSELF!",5,51 likes,2
review_4495956243,Em Lost In Books,"Jan 22, 2022","Three thieves find themselves taking shelter in an abandoned general store after a robbery. Soon a leeter was dropped in the store seeking store owner's advice about some dilemma that a young woman was facing at that time in her life. Thieves after a heated discussion decides to help the young woman by answering her questions, thus starting a chain of questions and answers that takes the reader back and forth in time in the life of different people who at some point dropped a letter in the store in search of answers to their questions.

Many characters were introduced throughout the story. Some of their stories left me with teary eyes while others put a smile on my face. Despite many arcs in story everything was tied up neatly in the end making it a very satisfying read for me.

This was my second book by the author and this was a complete opposite of . He dealt with human emotions so differently here than , and I am in awe of him how he tells his stories. And that makes me want to read another of his book sooner.

Highly recommended.",5,,2
review_3342739319,Divine,"May 19, 2020","""You are not just here to fill space or be a background character in someone else's movie. Consider this: nothing would be the same if you did not exist. Every place you have ever been and everyone you have ever spoken to would be different without you. We are all connected, and we are all affected by the decisions and even the existence of those around us."" --David Niven
This was truly a heartwarming yet tear-inducing read reminiscent of the quaint magic Studio Ghibli films always have. No one would expect that Keigo Higashino, a resident powerhouse of the Japanese crime fiction genre, would be the genius behind this masterpiece. However, I noticed that all of his books always examine the value of filial love and have a heartfelt theme despite the fact that the story centers on a murder.

The Miracles of the Namiya General Store follows this theme as well and At times, I was frustrated with the three delinquents' brash ignorance and I wished that their personal stories were also examined more. However, they had developed by the end quite well and I was really touched with their reflections brought by the magic pervading in the store.

I really felt elated and full of love while reading this book! This is by far one of my favorite pieces from Keigo Higashino, and I'm now sure of the fact that he's my favorite author of the year.

P.S. There's also a movie released in 2017 so I'm off to watch it now and cry all over again HAHAHA.
P.P.S. I just finished watching the movie and I loved it especially when the song Reborn was performed huhuhuh I still love the book more though as it's more nuanced and contemplative.",5,,2
review_4338670584,Joanna Chu (The ChuseyReader),"Nov 15, 2021","Thanks Teck for recommending this book! Omg this actually made me cry a few times which is a first!!

~ Quick Summary ~

Three delinquents hide out in an old abandoned general store where they exchange letters with people from the past who are seeking life advice and unexpectedly become life coaches 😆.

~ Pick this up if you enjoy/don’t mind ~

✨ Magic Realism

😢 Emotional and touching stories

🐢 Slower pace

😆 Some comedy

📚 ""the Housekeeper and the Professor” (I definitely enjoyed Namiya more!!)

~ What I loved ~

I loved the use of different POV and timelines because of how they connected. First we were introduced to the delinquents who stumbled upon the magical store and their first letter. I was disappointed when we changed POV but seeing the letter and from a different perspective was actually quite hilarious because it was so brutally honest and I could imagine the delinquents blabbering about what to write.

This was very touching. The people seeking advice were normal, everyday people so they were relatable and it was easy to connect. The lessons that the characters learned were actually so amazing and touching. There were 3 moments that made me unexpectedly emotional. I even cried and that is rare!

~ What I didn’t enjoy ~

The stories were a little boring to begin with, but when the characters learn, develop and think about the advice, it does get interesting and tug at the heartstrings. As there are quite a few stories in there, we have to go back to the beginning to introduce the characters and their stories. So going through that process multiple times does slow down the pace for me.",4,74 likes,2
review_4121332755,chaity,"Jul 23, 2021","what you think this book is:-

what it actually is:-


unapologetically Japanese, beautifully crafted, and heartbreakingly uplifting— the miracles of the namiya general store is a miraculous piece of art and it probably deserves a little more love and appreciation than what its already getting.

people don’t drift apart for one specific reason. well, you might be able to find a reason, but you could come up with one only after you made up your mind, a tired excuse tacked on after the fact.



while i'm mourning all that's been lost in translation, i'm still feeling hopeful and would recommend this book to anyone wanting to hear the stories that this book tells. it, my friend, is a story of some boys next door, of an athlete, of that one golden hearted and talented musician, it's a story of an orphanage, it also happens to be a story of a love, and most of all a story made up with words that were left unsaid, it' s a story of many people that i, unfortunately, will never have the privilege to meet. im never going to meet namiya, i will never get any piece of advice from him, but maybe i can be the namiya is someone else's life, who knows?


anyways, a few realization⤵

➜it's you who changes your life, it's you who has to get up from your bed in the morning, and deal with the world. and you do have control over almost everything in your life.
➜everyone needs advice, but at the end of the day the answer lies in your heart. you already know the solution, you just need someone to show you the path sometimes. and it's okay to seek help.
➜every decision we take, make makes us us
➜we all are, as human beings, somehow connected.





lastly, all my friends loved this book a little bit more than i did. i can tell its mostly me, not the book. i'm not a huge fan of magical realism aspect in contemporary fiction and the time jump is something that easily manages to give me headaches. also the writing put me off. but i dont regret giving it a try. it was worth it.",3,46 likes,2
review_4703116967,Liong,"May 06, 2022","An exciting and touching story.

A story tells another story.

When I read the second chapter, I thought I read a new story. They are related.

The author can tell a complicated mystery smoothly and randomly.

I enjoyed reading it slowly.

No wonder this book is rated so high. One of the best fiction I ever read.

Great storybook.",5,64 likes,2
review_4519025444,Zainab,"Feb 05, 2022",The only downside of this book? It ends.,5,43 likes,2
review_4122257785,Maisha Farzana (on hiatus),"Jul 18, 2021","=》4 stars

Buddy read with Chaity, Sinthia, Rajeswari and Maliha. 💖💖

“People don't drift apart for one specific reason. Well, you might be able to find a reason, but you could come up with one only after you made up your mind, a tired excuse tacked on after the fact. If their hearts were still in it and their bond was threatening to sever, you'd think one of them would step in and try to fix things. When no one does, you you know the bond has already been broken.”


The Plot: Atsuya, Koehi and Shota - three really close friends are currently on a run. They have done something very wrong. They just robbed a woman.Trying to find the perfect to hide, they come across to an old abandoned house. To be more specific a decades old general store- The Namiya General Store. They take shelter there for a night. But they never imagined that this ""one night"" will change their whole lives.

This deeply moving story follows several different characters across decades in time, all of them linked by a magical little place; a general store called ""The Namiya General Store"". A old named Mr. Yuji Namiya is the owner of this store. He’s a man living the last phase of his life. His wife has passed away and he decides on a whim to give written advice to correspondents. So, he starts accepting handwritten letters from anyone who has a question to ask and try his earnest to give them the right replies and advices. That's how this incredible journey of the Namiya General Store begins......

◇ I loved:

*The writing: I really loved the easy and accessible writing of this book. It was very simple yet elegant. I just flew through the writing. The translation was amazing.

*The characters: This book features a huge cast of diverse characters. The author has beautifully portrayed all of these characters. Loved how the story is told from different perspectives across the time. All of the characters belong to different times and places. So, their way of thinking, their conflicts and decisions weren't similar. That's what made everything seem so real. All of the characters are inter-connected and the common connection they have is the Namiya General Store. I liked the characters cast a lot. The only problem I faced with it was that I couldn't remember their names. There are lots of names and I kept forgetting them. This somehow affected my reading experience. As I told you, all the characters are inter-related. So, It's for the best to remember them all. And I couldn't. I just couldn't memorize who is who. By the way, the aspiring musician was my favourite character. Loved Sota too.

*The letters: The letters were life. Okay? I absolutely adored all these different types of letters. The author weaves an intertwining tapestry of human relationships that transcends time. I highly admired the way the author sewed all these broken promises and conflicted hearts together and crafted this masterpiece of a book.

*Others: ""The Miracles of the Namiya General Store"" is a heart breaking tale of humanity, finding ones true self, our conflicts, the decisions we make and how a single piece of word can change our lives. Mr. Namiya started a wonderful job and the three boys finished it.

◇ Cons: The main problem I had with the book is the time jumps. They were bit too much. The jumps between time and places confused me. For a moment, we are here in the 21st century and then, suddenly we are in the 80s. Well, that felt kinda under whelming.

“Be a fighter. Give it everything you’ve got. Even a losing battle is worth fighting. Go out and make your mark.”


Despite having a con or two, this book is a must read for everyone. I devoured it. I really liked it and enjoyed the whole time reading it. Now, I am really really interested in checking out more books by Japanese authors.

P.S. There is also a movie. Check that one out...",4,32 likes,2
review_4122127884,Mahbuba Sinthia,"Jul 24, 2021","Buddy read with Rajeswari, Himi, Chaity and Maliha 💗

I wish there were a Namiya General Store everywhere around the world. If not so, just one person like Yuji Namiya, who'd take even pranks seriously.

This book was heart melting. It felt like a warm hug across time. It made me laugh, it made me cry, it made me nostalgic, it made me believe in miracles.

If this book had nothing but those letters, sent through the mail slot and answered in the milk crate, it'd still be a wonderful book. But the author gave every letter a story and some wonderful characters. And of course - the miracles, the time travelling of not just the letters, but also lives and emotions.

In the five chapters, we found seven different stories. Five of them were of the seekers of advices, one was of Yuji Namiya himself and another was of the brutal advice givers! Five who sought advices, took them differently. One could only see what she wanted to see. One stuck to the advice untill the very end. One realised the inner meaning and took her decision accordingly. One didn’t take the advice and the other found some ""premonitions"" unasked.

But the most amazing thing is, all of the stories were interconnected through time and space. The author left no loose threads. He woved them all together and created this outstanding piece of literature.",5,17 likes,2
review_2372497115,Nattapan,"Apr 27, 2018","4.5 stars. Very memorable!!

This quote might be good enough to give you an idea about this great book.

“The key to accepting responsibility for your life is to accept the fact that your choices, every one of them, are leading you inexorably to either success or failure, however you define those terms.” (Neal Boortz)",4,17 likes,2
review_3880684026,K.J. Charles,"Mar 09, 2021","A very soft and cuddly book. Premise: a general store manager randomly becomes an agony uncle of sorts, answering anonymous questions and doing his best to help. 33 years after his death, three young hoodlums hole up in the abandoned store, and find letters from the past coming through the letterbox. So they start answering them, rather less tactfully.

The stories are nicely interwoven, the time jump aspect nicely worked out, and the way the advice works is fun, as we see people interpreting and reacting to the advice in ways shaped far more by themselves than by the advice givers. Yes, whimsical, bit sentimental, and the translation is rather clunky, but whatever: it's a feel-good book (though with quite a lot of hard things noted about Japan and capitalism and sexism) and the ending is super uplifting and really nicely led up to. However, if I gave stars I would have to dock one for the realisation that the 1980s are now basically a period of historical rather than contemporary fiction. Goddammit.",0,31 likes,2
review_4131199354,Henny,"Jul 27, 2021","This was such a beautiful little story about life and all the lemons it will give you - but also the beauty of choice and the impact words can have on someone else's life.

My advice to everyone who has not read this book yet:
1. Read it.
2. Go into it knowing nothing more than the synopsis. You will be surprised.

Save to say, The Miracles of the Namiya General Store is one of the best books I read this year and one I will definitely come back to in the future.",4,15 likes,2
review_4122498172,~Rajeswari~,"Jul 23, 2021","Buddy read with Sinthia ,Maisha ,Maliha &Chaity 💕
Even a losing battle is worth fighting
Every time I read a Japanese book,my mind automatically feels more peaceful and serene.I see life and its hardships in a different light.This book revolves around a mysterious general store called “Namiya General Store’ which is famous for its advice.It shows us how good advice changes people’s lives.

Timing makes all the difference between success and failure
Aspects which attracted me
• The writing is quite amazing and the ability to create suspense was something out of the world
• The author chose a very soothing way of depicting sorrows and demises
• I loved how every story was connected with each other
• I can’t say in words how the stories hit me.After I finished the book, I sat down quietly for a long time deciphering the whole saga
• The plot is very unique and the characters were just what I wanted them to be
• I DIDN’T CRY :) But this time Sinthia did
Can you make a little time out of your hectic life to read this book?Please read this.Play a soothing Japanese Folk melody and lose yourself!",0,30 likes,2
review_2808149858,Ha-Linh,"Aug 04, 2020","Let’s just say the first book I read from Keigo is not a disappointment. I was really engaged from the start to the end, and reading the Vietnamese version makes me able to relate and sympathize more with the characters. Usually I don’t like the “time-traveling” type of book because stuff like that often has too many logical holes in it. But this story has just the right amount of unrealistic components that I could be totally comfortable with. I got it from the first set of letters that this will be somehow interwoven so it was not surprising. However, Keigo’s masterful way of story-telling and character-building still makes this book very interesting and engaging. We know the characters deeply enough to feel invested in their stories, but not too much so that we can still observe their fates unfold as an outsider. A solid 4*",4,14 likes,2
