review_2169610666,Narin Kim,"Oct 31, 2017","This magical story about a magical Store offers readers strange comfort. It is about 3 thieves looking for a place to hide on their way to escape from the police. They reach an old house that looks like an old General store and decides to make their way in, spend the night there, and make their way out in the morning. However, as they look around the house, they realize that there's something going on in this house. Something strange. They receive an envelope in the mailbox outside the store and gets shocked about it since the store seemed like it was closed decades ago, and the text in the mail seemed like it was from the past. The mail was about troubles this woman had and was asking them to help. They decide to reply back, and they soon realize that this store manager from a long time ago helped solve his villager's troubles. As the story goes on, they receive more envelopes and it shows different kinds of trouble different people have and how the 3 thieves reply back. This story is very interesting because it goes through the past and present times and how the thieves give feedback to those mails are quite funny, too. But at last, it shows heartwarming stories/troubles and big lessons of how they solved those troubles.

This is my lifelong book; also for many Koreans since it's a very well-known book in Korea. If there is an English version of this book, I would definitely recommend it to more elderly people since there are few parts where it may get a little confusing (time lapse between the past and present), and I think it has stories that more elderly people can relate to. It is such a great book and such an interesting book I can't even explain how good it was to me. I definitely would give this book 6 stars, If I could.",5,22 likes,2
review_3792386993,Tammie,"Sep 05, 2021","Honestly, I was kind of conflicted as to what to rate this because I don't think it's a perfect book - there's bits I'd like to be a bit more fleshed out, the translation felt a little clunky at times, but it's been about 15 minutes since I've finished it and every time I try to write up this review and my thoughts about it, I start crying. So I guess this book gets a 5 stars from me? This really isn't the type of book I usually go for, but I really did love it in the end, and I look forward to rereading it in the future whenever I need a little bit of comfort.",5,13 likes,2
review_2877331156,Marina,"Nov 26, 2019","** Books 120 - 2019 **

This books to accomplish Tsundoku Books Challenge 2019

3,5 of 5 stars!

I love how every chapter is connected with each other's stories! I love how the stories between the athletes and also the shop owner itself. It is my first time to read Keigo Higashino sensei wrote about fantasy surrealism since his specialty is Japan Mystery-thriller. this genre is not bad but i think i still love more his mystery-thriller masterpieces :)

*For Kim Seokjin of BTS who read this books*
At first i'm curious why Jin loves this book? Is it related to their Bangtan Universe world? When i finished read this books okay somehow it is related with Love yourself Highlight reel and Save me webtoon when the parallel world is exist and Jin as the main character wanna save all the members so he repeat time all over and over again so he can chose the perfect scheme for all of them. Time and parallel world is one of the main highlight of this books

Now i'm curious about the movie is. Do you know where i can watch the movie is? XD",4,11 likes,2
review_3639202321,Tiash .,"Nov 11, 2020",This magical book changes life.,5,12 likes,2
review_963035728,Hui-chen Lin,"Jun 09, 2014",It is a cute and sweet story. I smiled and laughed while I was reading this book. I did enjoy reading conversation among those 3 guys. It is a book that makes me relaxed and and feel warm. Enjoy reading it!,4,11 likes,2
review_4690037436,Paul Ataua,"Apr 25, 2022","A collection of magical and connected stories surrounding a general store that gives advice to those in need of help. That is not a very helpful description of what you are going to read, but it seems best to give as little away as possible. This is just so completely different than his detective novels. It’s gentle, warm, and caring. It fits well within that kind of magical storytelling that the Japanese do so well. A satisfying read!",4,11 likes,2
review_2972538709,Christine Sandquist,"Sep 19, 2019","The Miracles of Namiya General Store is a book of interconnected short stories focusing on the lives of individuals who were helped or shaped by both the store and a nearby orphanage, called Marumitsuen. It follows a group of delinquents, an Olympic fencer, and a real estate tycoon amongst others. It’s a book about how everyone’s lives are connected to one another, how one small action can lead to much larger impacts spanning across generations.

This book comes full circle, showing how the past has impacted the future. The book opens on three young men, orphans who grew up in Marumitsuen, as they escape from a house they robbed. They’re in their getaway car, discussing plans for the night… their car breaks down. They hoof it over to an abandoned house nearby, where they intend to lay low for the night. Gradually, they begin to notice that things aren’t adding up… the clock on their phones is working strangely, and there’s an odd aura pervading the space. When a letter drops in through the mail slot requesting advice, they know something is up. Their first instinct is to leave, but ultimately… they don’t want to leave the author of the letter unanswered. She is a fencer training for the Olympics, and her boyfriend is struggling with cancer. Although he encourages her to live out their dream for her and keep training as hard as she can, she’s torn between acceding to his wishes and spending her time supporting him through chemotherapy.

As they correspond with her, they come to an abrupt realization: “Moon Rabbit,” as she signs her letters, is not from the present. The letters are coming across years to reach them. She’s confused when they mention the Internet or cell phones, and they ultimately nail down the “when” of her time by asking about favorite songs and films. Moon Rabbit is writing to them from 1979…. the year prior to Japan boycotting the Olympics. Armed with this knowledge, the boys give her advice and do their best to dissuade her from pursing her training and encourage her to stay with her partner. This doesn’t quite work as they intended, but it does ultimately work out for the best.

“He’s an amazing guy. No tricks, no bullshit. I mean, when I told him about my problem, he practically bopped me on the head. But he forced me to figure things out and see that I was getting in my own way. He’s the reason why I was finally able to stop worrying and throw myself into the training.”

After they finish their correspondence with Moon Rabbit, another letter drops in. As the novel progresses, it focuses on multiple other points of view so that we seen not only the letters from each of these individuals, but also how they implemented the advice they were given and about their lives back in time.

While I feel that the core conceit of this book was solid, I felt that overall the plot alone wasn’t enough to justify the slice-of-life nature of this story. Slice of life is very difficult to write well, given that the other elements of the book need to be strong enough to overcome the lack of plot. Characters, atmosphere, and prose are key to a successful novel… and unfortunately, I found that they did not come through with enough strength for me to be fully drawn in to this book. Given the glowing reviews of this book as it is written in other languages, I suspect part of this may be due to a slightly lackluster translation – in the original Japanese, it’s very possible that the prose is utterly to die for. The English version, unfortunately, leaves a bit to be desired and comes off as dry and slightly simplistic.

All in all, this is a good book to read if you want something that’s optimistic as well as a quick and easy read. It’s friendly, cozy, and extremely accessible. This is probably a better fit for people who tend to read fiction as opposed to fantasy or science fiction, as these elements are somewhat lighter than I might have hoped. The story overall is very grounded in reality and feels more like a parable of sorts rather than the exploration of new ideas I tend to expect from speculative fiction.

This review and others can be read on my blog, Black Forest Basilisks.",3,9 likes,2
review_3443657664,Mobyskine,"Jul 15, 2020","This book is so miraculously incredible I can't stop swooning over it. Starstruck!

Never thought I would be this satisfied after reading a book, this probably one of my best reads this year. I have read 7 books by Keigo Higashino of which on crime thriller and investigation, but The Miracles of the Namiya General Store was totally out of that kind of genre, okay maybe it has a bit of crime in it but this book touches more on humanity and spirits, one's dream that crawls into a parallel universe and intertwined the past and future.

I love how each stories connected and creating a new narrative, on how Yuji Namiya started the miracles-- ""I treat every letter that comes in as a cry for help. These people are no different from the rest of us. They have a hole in their hearts, and something vital is bleeding out. You can't ignore someone who speaks to you from the heart."" The characters were superb-- the three dudes, the musician, the dubious doggy, Paul Lennon also Ms. Moon Rabbit-- they were all my favorite! The story-telling was magnificently inspiring, development and plot transition from each stories were well written, I really enjoyed every bits of it. Love that pinch of The Beatles and few insight of Japan's history.

It was sweet and fantastical, not the usual Keigo Higashino but better. Namiya General Store should continue its service!

""A blank map means you can fill it in however you like. It’s entirely up to you. Everything is open; the possibilities are limitless. It’s a beautiful thing. I can only hope this helps you find a way to start believing in yourself.""

Perhaps it was true that someone in the sky might be tugging on the invisible strings!",5,11 likes,2
review_4122365130,Maliha Tabassum Arna,"Jul 18, 2021","Buddy read with ~Rajeswari~, Chaity, Mahbuba Sayed Sinthia, Maisha Farzana Himi.

""NO MATTER HOW BAD THINGS ARE TODAY, THEY'LL BE FAR BETTER TOMORROW.""
-Namiya General Store.
***** A real 5 star book.
Namiya and nayami, the Japanese word for problems, woes, whatever. If you come by the Namiya General Store in XX city after hours and slip a letter through the mail slot in their shutter, an answer will be waiting for you in the milk crate around back in the morning. By keeping this in front, the Namiya General Store's Mr. Namiya used to answer little childrens letter and gave advices. Advice 'bout life, 'bout studies and everything..... Like that- a que. ""Tell me how I can get an A+ on a test without studying or cheating or anything."" And it's ans. from Mr. Namiya- ""Ask your teacher to test you on yourself. Since you're the topic of the test, whatever you say will be correct."" this really shows, what a person Namiya was!
The book is so much well writtened (and the translation was also WOW!) that many times I felt the deepest infatuation of my heart for the persons of this book. There was different stories in 1st 4 chapters and in the 5th, they all came in the same place . The last (last~est~) reply of the blank letter was really a miracle! The book was like TIME TRAVELLING !
In most time I feel jealous of the Japanese Writers. Now, I need a Namiya General Store! Who will give me a Mr. Namiya....!!!!
Love this than many other books.",5,9 likes,2
review_3435599857,Lauren,"Oct 14, 2021","This book is beautifully written and effortlessly intertwines the various characters’ lives we encounter throughout. There is a completeness to this book which you don’t find in most other novels and this is why it is such a satisfying read.

I will say I didn’t love all of the 5 chapters equally and felt that chapter 4 was the weakest. Conversely chapter 2 was the one which affected me the most emotionally and chapter 3 also really stood out to me as a very strong story. There is an affecting poignancy to all of the chapters and characters’ lives and the advice the owner (and later the 3 delinquents give) to ordinary citizens is life-affirming and fundamentally human.

I was touched throughout whilst reading this magical and thought-provoking book and some of the chapters will stay with me for a while to come (including that ending)! *shivers*",4,9 likes,2
review_3460409376,Stephi,"Sep 21, 2020","The Miracles of the Namiya General Store is the heartwarming and magical story of three delinquents who end up in an abandoned general store, where, to their surprise, a request for advice arrives through the mail slot.

""Harassment, pranks, it doesn't matter to me. I treat every letter that comes in as a cry for help. These people are no different from the rest of us. They have a hole in their hearts, and something vital is bleeding out...You can't ignore someone who speaks to you from the heart.""

This book cleverly weaves together the story of all its characters into a complex tapestry of relationships forged throughout time. I loved the detail and nuance in each letter-writer's personal story and background, but wished the three men giving advice were also developed a bit more.

At first, I was annoyed by how harsh and ignorant the men's, and especially Atsuya's, advice was, but I loved their development through the novel as they grew and learned from each correspondent.

(view spoiler)

4.5 stars",4,7 likes,2
review_3815871319,Nazr•A,"Feb 03, 2021","One for the tresna-sukma-manira shelf!
Really LOVED this!",5,8 likes,2
review_3076775759,Ian Josh,"Jan 14, 2020","I enjoy Higashino very much, and his last work translated into English (The Newcomer) was of a sweeter variety than his mysteries, but I liked it... but sometimes there’s just too much.

I enjoyed the setup in this novel. The hints and beginning of something magical. It helped I started just before Christmas and I couldn’t help but see some comparisons to One Magic Christmas, a film that is arguably too sappy, but also sometimes feels just perfect.

Maybe I should have finished this book by Christmas Eve, before the Magic drifted away? Maybe?

But even taking a chance to relax this holiday season before picking this up to finish in the early days of January can’t be used as an excuse for what is either weak plotting, or possibly mid-decisions by the translator or his editors.

If the Japanese was this sappy, the English should have had just a little pulled away. Besides that, if Higashino over explained every little nugget, than a strong English editor should have been brave enough to say that this wasn’t necessary in English.

It’s fun when something from page 10 connects to something on page 150, but much less so when it’s pointed out, or screamed out, as it is here.

“Hey look, look what I did. Isn’t it smart and cute and sweet? See, this character is connected to that one, and these two are the same person... see, look, don’t miss it.”

A little subtlety would have improved this book a lot, and a bit more editing could have grown what began as promising and interesting into a more enjoyable book.

As it is, this is easily the worst of the Higashino books available in English and I can’t recommend it his fans or fans of sweet magical tales.

A shame, as it feels like it could have been much better, especially with Higashino as the writer.",2,7 likes,2
review_2598441299,Irene ➰,"Mar 27, 2020","3.5/5

It was awesome to see how the different stories are all intertwined. The concept was very good and unique as well. It was a jump between past and present all in a single night and it was very interesting.

What fell short was for me the structure of the book. It is divided in different parts but every single one follows the exact same format, repeating the same dynamics over and over again, so unfortunately in the end I got bored.

The characters were okay but they could have been worked out better, they were all a little flat.

So overall it was interesting to see how the story developed and ended but it reaped the same building over and over.",3,8 likes,2
review_4408423097,cherelle,"Dec 27, 2021","a novel that illuminates how human connection can transcend time, about our inner conflicts and how a few words can change someone's life for the better, and the knowledge that our lives are inevitably woven together in ways we can't imagine, the miracles of the namiya general store was just the read to remind me of the paths we take to find our truest selves.

my heart is now so full.

rating: 4 stars // RTC",4,8 likes,2
review_3126557730,Reading_ Tamishly,"Jan 07, 2020","Nope. No, this isn't your typical detective-murder-hunt-the-rat book. This is almost a psychological thriller where the answer has been thrown to the reader from the very first page yet it gives the thrill with amazing twists and turns as to why the character did what he did.
The title has been so aptly given. It explains everything! Damn this book is so good. The mathematician genius clashing with his old school mate, another Physics genius. Everything is out there. Nothing much to solve to find who who did the obvious or the reasons behind it. It's the intense character study and presentation that made the book so damn amazing. Yes, shortcomings are there when things tend to fly above your head when these two seemingly geniuses talk about the same things. I don't think it was even necessary. But still....wow...I was wowed...and wowed still.

For a book like this, if I try to write something about the story or the plot it will just ruin everything. So I won't. But I guarantee you it's a very different read with indepth character study and reasons why and what of the event that happened. Ah, the devotion. Seriously, it's all about this devotion.

This book is crazy good madness.",5,119 likes,3
review_2322855571,carol.,"Apr 08, 2018","Both unusual and familiar, The Devotion of Suspect X is an unassuming mystery with an astonishing approach.

It is a book that will toy with the very definition of the concept of 'spoilers:' it begins with a few hours in our main characters' daily routines, then quickly jumps into an emotional scene that results in murder. I admit that I was doubtful; how was I to stay interested in a mystery where I already knew the answers to the 'who-what-where-why-when?' But Hiashino is quite masterful, drawing a veil over the disposition of the body. The reader is left in a unique position of knowing more than the police about where the investigation should end, but discovering clues with the police as they work backwards.

The narrative follows both the police investigation and the viewpoint of the perpetrator(s), leaving me marveling at the chess game. Something in it puts me in mind of Agatha Christie, although it could be that she's just the one I always think of when it comes to non-gory murder and a more nuanced form of suspense. It is a book that is as much about characters and social protocols as much as mystery, but don't let that frighten you away. There's a distinct whiff of literary-fiction about this as well, a story that is also about the everyday lives and the future dreams of the characters.

My complaints are very small; there was a preponderance of characters whose names began with 'K,' and I believe at least two had first and last names with 'K.' A switch from first to last name use depending on who was talking proved initially confusing and left me glad I could flip back a few pages. The ending... sigh. Appropriate, but leaving me ambivalent. The air of melancholy is too strong for me to want to add this to my library, thus the less than 5 stars.

The fact that this was a best-seller in Japan left me bemused. According to the author's GR page, ""The Devotion of Suspect X was the second highest selling book in all of Japan— fiction or nonfiction—the year it was published, with over 800,000 copies sold."" I find this especially interesting when I think of the mysteries thrillers that routinely top American best-seller lists. This is almost the exact opposite kind of story, and for me, a far more fulfilling one. It leaves me curious to check out Higashino's other works.


Four and a half bento boxes.

Thanks to the Carols and Vivian for having left such thoughtful reviews that intrigued me enough to request it!",5,194 likes,3
review_120488544,Irene,"Sep 07, 2010","Not only is THE DEVOTION OF SUSPECT X a multi-faceted cultural reading experience, but it also acutely complements the familiar psychological suspense/thriller/mystery genre by infusing Japanese philosophy. Keigo Higashino shrewdly and subtly induces the reader to contemplate the immeasurable complexities of the human psyche by questioning what motivates one human being to judge who is worthy of life, and who is not.

Tetsuya Ishigami’s daily schedule is precisely what one would expect of a Japanese mathematics’ teacher. His unsuccessful attempts to motivate visibly bored and apathetic students discourage Ishigami, and his one true passion of solving a complex mathematical formula, lies outside of the classroom within the confines of his small apartment. A barren life carved out of necessity dramatically changes when Yasuko and her daughter Misato introduce themselves as his new neighbors. He imagines a fantasy life with them, listening to mother and daughter through the thin apartment walls, and his daily walk to school includes a stop to purchase his boxed lunch at the small shop where Yasuko works. Within this fictitious context, Ishigami surprisingly exhibits a fierce desire to protect both mother and daughter, and so begins a bizarre tale that originates with the unexpected arrival of Yasuko’s nefarious ex-husband Togashi.

To divulge the minute intricacies of this suspenseful tale would require *spoilers.* Ishigami’s masterful, methodical, and devious scheme demands a skillful exposé by the incongruous, yet highly likeable duo of Dr.Yukama and Detective Kusanagi, the intrepid investigators who are destined to unravel the shocking and mind-boggling conundrum. Imperial University graduates in different fields, Ishigami, Yukama and Kusanagi, seem equally matched; Ishigami, unappreciated mathematical master of a methodical crime committed to protect Yasuko and Misato, and Yukama, preeminent master of rare intuitive observations of human frailties, and Kusanagi, resolute advocate of justice match their unparalleled wits to a stunning unbelievable conclusion. The factual drama predominantly hinges on the intellectual “cat and mouse” chase between Ishigami, “Buddha” at University and Yukama, affectionately known as “Professor Galileo” by the police.

Initially, the translation was a bit stilted, but once engrossed in the book, it was hardly noticeable. In addition to the utterly fascinating and distinctive premise, the cultural milieu depicted an informative contemporary view of Japanese life.",5,,3
review_1114626651,Carol,"Nov 24, 2014","The Devotion of Suspect X is a must-read for anyone who appreciates police procedurals, mysteries, math, Japan, literature . . . I could go on. The Devotion of Suspect X is the third in the Detective Galileo series, but I didn't once have the impression that I lacked background or relationship information gleaned from the initial 2 books. In fact, there were no references to prior cases or mysteries to suggest that earlier books existed. If not for the publishers blurbs on the book, I'd not have guessed they did.

So why is The Devotion of Suspect X an excellent read?
1. The lead detective, Kusanagi, is a normal, standard, by-the-book, thoughtful, straight arrow. What distinguishes this novel from other police procedurals is Kusanagi's friend, Yukawa, a physicist. Yukawa solves the mystery and cares deeply about the outcome. Because ....
2. Ishigami, a high school math teacher whose brilliance and devotion to math are here allocated to assisting his ordinary, likable next door neighbor in covering up a murder, by employing masterful misdirection to focus the police on time-wasting, unimportant questions and issues. His efforts to motivate apathetic high school students won my respect and, at the same time, my pity. Otherwise, he's not an easy character to get to know or to feel anything about, except that Yukawa's concern for him makes the reader care. Nonetheless you respect his genius.
3. The ending is one of the best I've ever read. The mystery is solved 20 pages before. It doesn't matter. There's many a thriller or mystery novelist who get an A+ for plot, but don't have a clue how to write a compelling ending. I read the last several paragraphs a few times over - they were just that good.
4. Japan. The style of this novel is insanely plot-driven and at the same time calm, quiet, methodical, and thoughtful. No screeching tires. No bickering between the detectives. No threatening with guns. In an alternative universe where Lee Child is raised and lives in Japan, this might be the series he'd have written instead of the Jack Reacher books (which I also love, for different reasons, and which are culturally and quintessentially American).

Off to find my next Detective Galileo book....",5,,3
